{"contract_version": "photo-experimental-v2", "request_id": "synthetic", "result_kind": "experimental", "method": "photo_native_v12_experimental", "photo_engine": "native_v12", "status": "partial_success", "image_base64": "iVBORw0KGgoAAAANSUhEUgAAAAkAAAAHCAIAAABV+fA3AAAAGmVYSWZNTQAqAAAACAABARIAAwAAAAEAAQAAAAAAABPAdecAAAAvSURBVHicY2RgYJDl1saKWNjlBdm5sSOQXDu34Fw8crIootoIOXxmogpBNRHQBwBT2QxsPB4AjwAAAABJRU5ErkJggg==", "mime_type": "image/png", "image_width": 9, "image_height": 7, "source_exif_orientation": 1, "coordinate_system": "encoded_original_pixels", "source_sha256": "1422468ce430444a102acc16400573ed747500837a8786fb48548d8b1cef1cfb", "source_RGB_sha256": "da1eefe13fbe6f95ec12b9bd7264ab986d61a00762f5af6ffb902236c75bf439", "returned_RGB_sha256": "37728a2940bda4d8a4342bf3fd20a2565230dc65f9dea1b9819fe769e77d80b5", "candidate_components": 2, "transformed_components": 1, "rejected_components": 1, "changed_RGB_pixels": 1, "accepted_permission_mask": {"encoding": "png_uint8_0_255", "image_base64": "iVBORw0KGgoAAAANSUhEUgAAAAkAAAAHCAAAAAD/8Di8AAAAGmVYSWZNTQAqAAAACAABARIAAwAAAAEAAQAAAAAAABPAdecAAAAXSURBVHicY2CAAcb/IALEYoKLIVj4AQA8MgEGfXd8ZAAAAABJRU5ErkJggg==", "png_sha256": "ed04165fcebe7a754a82a4203c3d737e3f96656d3e9d37e6636a20d6371f07e8", "boolean_pixel_sha256": "6a337a69f4229ae777f4918712546042f18787fcfce053f06f737a8d61e200d7", "pixels": 12}, "rejected_permission_mask": {"encoding": "png_uint8_0_255", "image_base64": "iVBORw0KGgoAAAANSUhEUgAAAAkAAAAHCAAAAAD/8Di8AAAAGmVYSWZNTQAqAAAACAABARIAAwAAAAEAAQAAAAAAABPAdecAAAAYSURBVHicY2DABxjB5H8GBkYmuBiChQAAIs8BBhhB85YAAAAASUVORK5CYII=", "png_sha256": "62cab7f7ac210afb0afad0e4ce4c9f5ccb11685110bf505395d0ec8dce7691df", "boolean_pixel_sha256": "2a975528d3968fe68a9468655980070df4ab3e215319cc745d3ed7873cb92574", "pixels": 9}, "region_display_bounds": [{"region_id": 1, "status": "transformed", "reason_code": "TRANSFORMED", "mask_pixels": 12, "changed_RGB_pixels": 1, "permission_boolean_sha256": "6a337a69f4229ae777f4918712546042f18787fcfce053f06f737a8d61e200d7", "x": 0, "y": 0.14285714285714285, "width": 0.4444444444444444, "height": 0.42857142857142855, "bounds_are_not_filled_permission": true}, {"region_id": 2, "status": "rejected", "reason_code": "REJECT_PITCH_UNOBSERVED", "mask_pixels": 9, "changed_RGB_pixels": 0, "permission_boolean_sha256": "2a975528d3968fe68a9468655980070df4ab3e215319cc745d3ed7873cb92574", "x": 0.5555555555555556, "y": 0.42857142857142855, "width": 0.3333333333333333, "height": 0.42857142857142855, "bounds_are_not_filled_permission": true}], "bounds_are_not_filled_permission": true, "processing_ms": 1, "warnings": ["EXPERIMENTAL_UNAPPROVED", "UNDETECTED_FINGERPRINTS_POSSIBLE", "COUNTS_ARE_PERMISSION_COMPONENTS_NOT_FINGERS", "REJECTED_REGIONS_RETAIN_ORIGINAL_PIXELS"], "privacy_validated": false, "production_approved": false, "complete_photo_protection_verified": false, "independent_final_test": false, "evaluation": null}